NAICS Code,NAICS Title,MICS Code,MICS Title
11,"Agriculture, Forestry, Fishing and Hunting",11,Agroforestry
111,Crop Production,111,Crop Farming
1111,Oilseed and Grain Farming,111,Crop Farming
11111,Soybean Farming,111,Crop Farming
11112,Oilseed (except Soybean) Farming,111,Crop Farming
11113,Dry Pea and Bean Farming,111,Crop Farming
11114,Wheat Farming,111,Crop Farming
11115,Corn Farming,111,Crop Farming
11116,Rice Farming,111,Crop Farming
11119,Other Grain Farming,111,Crop Farming
111110,Soybean Farming,111,Crop Farming
111120,Oilseed (except Soybean) Farming,111,Crop Farming
111130,Dry Pea and Bean Farming,111,Crop Farming
111140,Wheat Farming,111,Crop Farming
111150,Corn Farming,111,Crop Farming
111160,Rice Farming,111,Crop Farming
111191,Oilseed and Grain Combination Farming,111,Crop Farming
111199,All Other Grain Farming,111,Crop Farming
1112,Vegetable and Melon Farming,111,Crop Farming
11121,Vegetable and Melon Farming,111,Crop Farming
111211,Potato Farming,111,Crop Farming
111219,Other Vegetable (except Potato) and Melon Farming,111,Crop Farming
1113,Fruit and Tree Nut Farming,111,Crop Farming
11131,Orange Groves,111,Crop Farming
11132,Citrus (except Orange) Groves,111,Crop Farming
11133,Noncitrus Fruit and Tree Nut Farming,111,Crop Farming
111310,Orange Groves,111,Crop Farming
111320,Citrus (except Orange) Groves,111,Crop Farming
111331,Apple Orchards,111,Crop Farming
111332,Grape Vineyards,111,Crop Farming
111333,Strawberry Farming,111,Crop Farming
111334,Berry (except Strawberry) Farming,111,Crop Farming
111335,Tree Nut Farming,111,Crop Farming
111336,Fruit and Tree Nut Combination Farming,111,Crop Farming
111339,Other Noncitrus Fruit Farming,111,Crop Farming
1114,"Greenhouse, Nursery, and Floriculture Production",111,Crop Farming
11141,Food Crops Grown Under Cover,111,Crop Farming
11142,Nursery and Floriculture Production,111,Crop Farming
111411,Mushroom Production,111,Crop Farming
111419,Other Food Crops Grown Under Cover,111,Crop Farming
111421,Nursery and Tree Production,111,Crop Farming
111422,Floriculture Production,111,Crop Farming
1119,Other Crop Farming,111,Crop Farming
11191,Tobacco Farming,111,Crop Farming
11192,Cotton Farming,111,Crop Farming
11193,Sugarcane Farming,111,Crop Farming
11194,Hay Farming,111,Crop Farming
11199,All Other Crop Farming,111,Crop Farming
111910,Tobacco Farming,111,Crop Farming
111920,Cotton Farming,111,Crop Farming
111930,Sugarcane Farming,111,Crop Farming
111940,Hay Farming,111,Crop Farming
111991,Sugar Beet Farming,111,Crop Farming
111992,Peanut Farming,111,Crop Farming
111998,All Other Miscellaneous Crop Farming,111,Crop Farming
112,Animal Production and Aquaculture,112,Animal Farming
1121,Cattle Ranching and Farming,112,Animal Farming
11211,"Beef Cattle Ranching and Farming, including Feedlots",112,Animal Farming
11212,Dairy Cattle and Milk Production,112,Animal Farming
11213,Dual-Purpose Cattle Ranching and Farming,112,Animal Farming
112111,Beef Cattle Ranching and Farming,112,Animal Farming
112112,Cattle Feedlots,112,Animal Farming
112120,Dairy Cattle and Milk Production,112,Animal Farming
112130,Dual-Purpose Cattle Ranching and Farming,112,Animal Farming
1122,Hog and Pig Farming,112,Animal Farming
11221,Hog and Pig Farming,112,Animal Farming
112210,Hog and Pig Farming,112,Animal Farming
1123,Poultry and Egg Production,112,Animal Farming
11231,Chicken Egg Production,112,Animal Farming
11232,Broilers and Other Meat Type Chicken Production,112,Animal Farming
11233,Turkey Production,112,Animal Farming
11234,Poultry Hatcheries,112,Animal Farming
11239,Other Poultry Production,112,Animal Farming
112310,Chicken Egg Production,112,Animal Farming
112320,Broilers and Other Meat Type Chicken Production,112,Animal Farming
112330,Turkey Production,112,Animal Farming
112340,Poultry Hatcheries,112,Animal Farming
112390,Other Poultry Production,112,Animal Farming
1124,Sheep and Goat Farming,112,Animal Farming
11241,Sheep Farming,112,Animal Farming
11242,Goat Farming,112,Animal Farming
112410,Sheep Farming,112,Animal Farming
112420,Goat Farming,112,Animal Farming
1125,Aquaculture,112,Animal Farming
11251,Aquaculture,112,Animal Farming
112511,Finfish Farming and Fish Hatcheries,112,Animal Farming
112512,Shellfish Farming,112,Animal Farming
112519,Other Aquaculture,112,Animal Farming
1129,Other Animal Production,112,Animal Farming
11291,Apiculture,112,Animal Farming
11292,Horses and Other Equine Production,112,Animal Farming
11293,Fur-Bearing Animal and Rabbit Production,112,Animal Farming
11299,All Other Animal Production,112,Animal Farming
112910,Apiculture,112,Animal Farming
112920,Horses and Other Equine Production,112,Animal Farming
112930,Fur-Bearing Animal and Rabbit Production,112,Animal Farming
112990,All Other Animal Production,112,Animal Farming
113,Forestry and Logging,113,Forestry and Logging
1131,Timber Tract Operations,113,Forestry and Logging
11311,Timber Tract Operations,113,Forestry and Logging
113110,Timber Tract Operations,113,Forestry and Logging
1132,Forest Nurseries and Gathering of Forest Products,113,Forestry and Logging
11321,Forest Nurseries and Gathering of Forest Products,113,Forestry and Logging
113210,Forest Nurseries and Gathering of Forest Products,113,Forestry and Logging
1133,Logging,113,Forestry and Logging
11331,Logging,113,Forestry and Logging
113310,Logging,113,Forestry and Logging
114,"Fishing, Hunting and Trapping",114,Fishing and Hunting
1141,Fishing,114,Fishing and Hunting
11411,Fishing,114,Fishing and Hunting
114111,Finfish Fishing,114,Fishing and Hunting
114112,Shellfish Fishing,114,Fishing and Hunting
114119,Other Marine Fishing,114,Fishing and Hunting
1142,Hunting and Trapping,114,Fishing and Hunting
11421,Hunting and Trapping,114,Fishing and Hunting
114210,Hunting and Trapping,114,Fishing and Hunting
115,Support Activities for Agriculture and Forestry,115,Support and Other Agroforestry 
1151,Support Activities for Crop Production,115,Support and Other Agroforestry 
11511,Support Activities for Crop Production,115,Support and Other Agroforestry 
115111,Cotton Ginning,115,Support and Other Agroforestry 
115112,"Soil Preparation, Planting, and Cultivating",115,Support and Other Agroforestry 
115113,"Crop Harvesting, Primarily by Machine",115,Support and Other Agroforestry 
115114,Postharvest Crop Activities (except Cotton Ginning),115,Support and Other Agroforestry 
115115,Farm Labor Contractors and Crew Leaders,115,Support and Other Agroforestry 
115116,Farm Management Services,115,Support and Other Agroforestry 
1152,Support Activities for Animal Production,115,Support and Other Agroforestry 
11521,Support Activities for Animal Production,115,Support and Other Agroforestry 
115210,Support Activities for Animal Production,115,Support and Other Agroforestry 
1153,Support Activities for Forestry,115,Support and Other Agroforestry 
11531,Support Activities for Forestry,115,Support and Other Agroforestry 
115310,Support Activities for Forestry,115,Support and Other Agroforestry 
21,"Mining, Quarrying, and Oil and Gas Extraction",21,Natural Resource Extraction
211,Oil and Gas Extraction,211,Oil and Gas Extraction
2111,Oil and Gas Extraction,211,Oil and Gas Extraction
21111,Oil and Gas Extraction,211,Oil and Gas Extraction
21112,Crude Petroleum Extraction,211,Oil and Gas Extraction
21113,Natural Gas Extraction,211,Oil and Gas Extraction
211111,Crude Petroleum and Natural Gas Extraction,211,Oil and Gas Extraction
211112,Natural Gas Liquid Extraction,211,Oil and Gas Extraction
211120,Crude Petroleum Extraction,211,Oil and Gas Extraction
211130,Natural Gas Extraction,211,Oil and Gas Extraction
212,Mining (except Oil and Gas),212,Other Mining 
2121,Coal Mining,212,Other Mining 
21211,Coal Mining,212,Other Mining 
212111,Bituminous Coal and Lignite Surface Mining,212,Other Mining 
212112,Bituminous Coal Underground Mining,212,Other Mining 
212113,Anthracite Mining,212,Other Mining 
212114,Surface Coal Mining,212,Other Mining 
212115,Underground Coal Mining,212,Other Mining 
2122,Metal Ore Mining,212,Other Mining 
21221,Iron Ore Mining,212,Other Mining 
21222,Gold Ore and Silver Ore Mining,212,Other Mining 
21223,"Copper, Nickel, Lead, and Zinc Mining",212,Other Mining 
21229,Other Metal Ore Mining,212,Other Mining 
212210,Iron Ore Mining,212,Other Mining 
212220,Gold Ore and Silver Ore Mining,212,Other Mining 
212221,Gold Ore Mining,212,Other Mining 
212222,Silver Ore Mining,212,Other Mining 
212230,"Copper, Nickel, Lead, and Zinc Mining",212,Other Mining 
212231,Lead Ore and Zinc Ore Mining,212,Other Mining 
212234,Copper Ore and Nickel Ore Mining,212,Other Mining 
212290,Other Metal Ore Mining,212,Other Mining 
212291,Uranium-Radium-Vanadium Ore Mining,212,Other Mining 
212299,All Other Metal Ore Mining,212,Other Mining 
2123,Nonmetallic Mineral Mining and Quarrying,212,Other Mining 
21231,Stone Mining and Quarrying,212,Other Mining 
21232,"Sand, Gravel, Clay, and Ceramic and Refractory Minerals Mining and Quarrying",212,Other Mining 
21239,Other Nonmetallic Mineral Mining and Quarrying,212,Other Mining 
212311,Dimension Stone Mining and Quarrying,212,Other Mining 
212312,Crushed and Broken Limestone Mining and Quarrying,212,Other Mining 
212313,Crushed and Broken Granite Mining and Quarrying,212,Other Mining 
212319,Other Crushed and Broken Stone Mining and Quarrying,212,Other Mining 
212321,Construction Sand and Gravel Mining,212,Other Mining 
212322,Industrial Sand Mining,212,Other Mining 
212323,"Kaolin, Clay, and Ceramic and Refractory Minerals Mining",212,Other Mining 
212324,Kaolin and Ball Clay Mining,212,Other Mining 
212325,Clay and Ceramic and Refractory Minerals Mining,212,Other Mining 
212390,Other Nonmetallic Mineral Mining and Quarrying,212,Other Mining 
212391,"Potash, Soda, and Borate Mineral Mining",212,Other Mining 
212392,Phosphate Rock Mining,212,Other Mining 
212393,Other Chemical and Fertilizer Mineral Mining,212,Other Mining 
212399,All Other Nonmetallic Mineral Mining,212,Other Mining 
213,Support Activities for Mining,213,Mining Support
2131,Support Activities for Mining,213,Mining Support
21311,Support Activities for Mining,213,Mining Support
213111,Drilling Oil and Gas Wells,213,Mining Support
213112,Support Activities for Oil and Gas Operations,213,Mining Support
213113,Support Activities for Coal Mining,213,Mining Support
213114,Support Activities for Metal Mining,213,Mining Support
213115,Support Activities for Nonmetallic Minerals (except Fuels) Mining,213,Mining Support
22,Utilities,22,Utilities
221,Utilities,22,Utilities
2211,"Electric Power Generation, Transmission and Distribution",22A,Electricity Networks
22111,Electric Power Generation,22A,Electricity Networks
22112,"Electric Power Transmission, Control, and Distribution",22A,Electricity Networks
221111,Hydroelectric Power Generation,22A,Electricity Networks
221112,Fossil Fuel Electric Power Generation,22A,Electricity Networks
221113,Nuclear Electric Power Generation,22A,Electricity Networks
221114,Solar Electric Power Generation,22A,Electricity Networks
221115,Wind Electric Power Generation,22A,Electricity Networks
221116,Geothermal Electric Power Generation,22A,Electricity Networks
221117,Biomass Electric Power Generation,22A,Electricity Networks
221118,Other Electric Power Generation,22A,Electricity Networks
221119,Other Electric Power Generation,22A,Electricity Networks
221121,Electric Bulk Power Transmission and Control,22A,Electricity Networks
221122,Electric Power Distribution,22A,Electricity Networks
2212,Natural Gas Distribution,22B,Gas Networks
22121,Natural Gas Distribution,22B,Gas Networks
221210,Natural Gas Distribution,22B,Gas Networks
2213,"Water, Sewage and Other Systems",22C,"Water, Sewage and Other"
22131,Water Supply and Irrigation Systems,22C,"Water, Sewage and Other"
22132,Sewage Treatment Facilities,22C,"Water, Sewage and Other"
22133,Steam and Air-Conditioning Supply,22C,"Water, Sewage and Other"
221310,Water Supply and Irrigation Systems,22C,"Water, Sewage and Other"
221320,Sewage Treatment Facilities,22C,"Water, Sewage and Other"
221330,Steam and Air-Conditioning Supply,22C,"Water, Sewage and Other"
23,Construction,23,Construction
236,Construction of Buildings,236,Building Construction 
2361,Residential Building Construction,236A,Residential Building Construction
23611,Residential Building Construction,236A,Residential Building Construction
236115,New Single-Family Housing Construction (except For-Sale Builders),236A,Residential Building Construction
236116,New Multifamily Housing Construction (except For-Sale Builders),236A,Residential Building Construction
236117,New Housing For-Sale Builders,236A,Residential Building Construction
2362,Nonresidential Building Construction,236B,Nonresidential Building Construction
23621,Industrial Building Construction,236B,Nonresidential Building Construction
236210,Industrial Building Construction,236B,Nonresidential Building Construction
23622,Commercial and Institutional Building Construction,236C,Commercial and Institutional Building Construction
236220,Commercial and Institutional Building Construction,236C,Commercial and Institutional Building Construction
236118,Residential Remodelers,236D,Residential Remodelers
237,Heavy and Civil Engineering Construction,237,Heavy and Civil Engineering Construction
2371,Utility System Construction,237,Heavy and Civil Engineering Construction
23711,Water and Sewer Line and Related Structures Construction,237,Heavy and Civil Engineering Construction
23712,Oil and Gas Pipeline and Related Structures Construction,237,Heavy and Civil Engineering Construction
23713,Power and Communication Line and Related Structures Construction,237,Heavy and Civil Engineering Construction
237110,Water and Sewer Line and Related Structures Construction,237,Heavy and Civil Engineering Construction
237120,Oil and Gas Pipeline and Related Structures Construction,237,Heavy and Civil Engineering Construction
237130,Power and Communication Line and Related Structures Construction,237,Heavy and Civil Engineering Construction
2372,Land Subdivision,237,Heavy and Civil Engineering Construction
23721,Land Subdivision,237,Heavy and Civil Engineering Construction
237210,Land Subdivision,237,Heavy and Civil Engineering Construction
2373,"Highway, Street, and Bridge Construction",237,Heavy and Civil Engineering Construction
23731,"Highway, Street, and Bridge Construction",237,Heavy and Civil Engineering Construction
237310,"Highway, Street, and Bridge Construction",237,Heavy and Civil Engineering Construction
2379,Other Heavy and Civil Engineering Construction,237,Heavy and Civil Engineering Construction
23799,Other Heavy and Civil Engineering Construction,237,Heavy and Civil Engineering Construction
237990,Other Heavy and Civil Engineering Construction,237,Heavy and Civil Engineering Construction
238,Specialty Trade Contractors,238,Specialty Contractors
2389,Other Specialty Trade Contractors,238,Specialty Contractors
23891,Site Preparation Contractors,238,Specialty Contractors
23899,All Other Specialty Trade Contractors,238,Specialty Contractors
238910,Site Preparation Contractors,238,Specialty Contractors
238990,All Other Specialty Trade Contractors,238,Specialty Contractors
2381,"Foundation, Structure, and Building Exterior Contractors",2381,"Foundation, Structure, and Building Exterior Contractors"
23811,Poured Concrete Foundation and Structure Contractors,2381,"Foundation, Structure, and Building Exterior Contractors"
23812,Structural Steel and Precast Concrete Contractors,2381,"Foundation, Structure, and Building Exterior Contractors"
23813,Framing Contractors,2381,"Foundation, Structure, and Building Exterior Contractors"
23814,Masonry Contractors,2381,"Foundation, Structure, and Building Exterior Contractors"
23815,Glass and Glazing Contractors,2381,"Foundation, Structure, and Building Exterior Contractors"
23816,Roofing Contractors,2381,"Foundation, Structure, and Building Exterior Contractors"
23817,Siding Contractors,2381,"Foundation, Structure, and Building Exterior Contractors"
23819,"Other Foundation, Structure, and Building Exterior Contractors",2381,"Foundation, Structure, and Building Exterior Contractors"
238110,Poured Concrete Foundation and Structure Contractors,2381,"Foundation, Structure, and Building Exterior Contractors"
238120,Structural Steel and Precast Concrete Contractors,2381,"Foundation, Structure, and Building Exterior Contractors"
238130,Framing Contractors,2381,"Foundation, Structure, and Building Exterior Contractors"
238140,Masonry Contractors,2381,"Foundation, Structure, and Building Exterior Contractors"
238150,Glass and Glazing Contractors,2381,"Foundation, Structure, and Building Exterior Contractors"
238160,Roofing Contractors,2381,"Foundation, Structure, and Building Exterior Contractors"
238170,Siding Contractors,2381,"Foundation, Structure, and Building Exterior Contractors"
238190,"Other Foundation, Structure, and Building Exterior Contractors",2381,"Foundation, Structure, and Building Exterior Contractors"
2382,Building Equipment Contractors,2382,Building Equipment Contractors
23829,Other Building Equipment Contractors,2382,Building Equipment Contractors
2383,Building Finishing Contractors,2383,Building Finishing Contractors
23831,Drywall and Insulation Contractors,2383,Building Finishing Contractors
23835,Finish Carpentry Contractors,2383,Building Finishing Contractors
23839,Other Building Finishing Contractors,2383,Building Finishing Contractors
238310,Drywall and Insulation Contractors,2383,Building Finishing Contractors
238340,Tile and Terrazzo Contractors,2383,Building Finishing Contractors
238350,Finish Carpentry Contractors,2383,Building Finishing Contractors
238390,Other Building Finishing Contractors,2383,Building Finishing Contractors
23821,Electrical Contractors and Other Wiring Installation Contractors,238A,"Plumbing, Electrical or Painting Contractors "
23822,"Plumbing, Heating, and Air-Conditioning Contractors",238A,"Plumbing, Electrical or Painting Contractors "
238210,Electrical Contractors and Other Wiring Installation Contractors,238A,"Plumbing, Electrical or Painting Contractors "
238220,"Plumbing, Heating, and Air-Conditioning Contractors",238A,"Plumbing, Electrical or Painting Contractors "
23832,Painting and Wall Covering Contractors,238A,"Plumbing, Electrical or Painting Contractors "
238320,Painting and Wall Covering Contractors,238A,"Plumbing, Electrical or Painting Contractors "
23833,Flooring Contractors,238C,Flooring Contractors
23834,Tile and Terrazzo Contractors,238C,Flooring Contractors
238330,Flooring Contractors,238C,Flooring Contractors
238290,Other Building Equipment Contractors,238D,Building Equipment Contractors
31,Manufacturing,31,Consumer Goods Manufacture
311,Food Manufacturing,31A,Food & Beverage Manufacture
3111,Animal Food Manufacturing,31A,Food & Beverage Manufacture
31111,Animal Food Manufacturing,31A,Food & Beverage Manufacture
311111,Dog and Cat Food Manufacturing,31A,Food & Beverage Manufacture
311119,Other Animal Food Manufacturing,31A,Food & Beverage Manufacture
3112,Grain and Oilseed Milling,31A,Food & Beverage Manufacture
31121,Flour Milling and Malt Manufacturing,31A,Food & Beverage Manufacture
31122,Starch and Vegetable Fats and Oils Manufacturing,31A,Food & Beverage Manufacture
31123,Breakfast Cereal Manufacturing,31A,Food & Beverage Manufacture
311211,Flour Milling,31A,Food & Beverage Manufacture
311212,Rice Milling,31A,Food & Beverage Manufacture
311213,Malt Manufacturing,31A,Food & Beverage Manufacture
311221,Wet Corn Milling and Starch Manufacturing,31A,Food & Beverage Manufacture
311222,Soybean Processing,31A,Food & Beverage Manufacture
311223,Other Oilseed Processing,31A,Food & Beverage Manufacture
311224,Soybean and Other Oilseed Processing,31A,Food & Beverage Manufacture
311225,Fats and Oils Refining and Blending,31A,Food & Beverage Manufacture
311230,Breakfast Cereal Manufacturing,31A,Food & Beverage Manufacture
3113,Sugar and Confectionery Product Manufacturing,31A,Food & Beverage Manufacture
31131,Sugar Manufacturing,31A,Food & Beverage Manufacture
31132,Chocolate and Confectionery Manufacturing from Cacao Beans,31A,Food & Beverage Manufacture
31133,Confectionery Manufacturing from Purchased Chocolate,31A,Food & Beverage Manufacture
31134,Nonchocolate Confectionery Manufacturing,31A,Food & Beverage Manufacture
31135,Chocolate and Confectionery Manufacturing,31A,Food & Beverage Manufacture
311311,Sugarcane Mills,31A,Food & Beverage Manufacture
311312,Cane Sugar Refining,31A,Food & Beverage Manufacture
311313,Beet Sugar Manufacturing,31A,Food & Beverage Manufacture
311314,Cane Sugar Manufacturing,31A,Food & Beverage Manufacture
311320,Chocolate and Confectionery Manufacturing from Cacao Beans,31A,Food & Beverage Manufacture
311330,Confectionery Manufacturing from Purchased Chocolate,31A,Food & Beverage Manufacture
311340,Nonchocolate Confectionery Manufacturing,31A,Food & Beverage Manufacture
311351,Chocolate and Confectionery Manufacturing from Cacao Beans,31A,Food & Beverage Manufacture
311352,Confectionery Manufacturing from Purchased Chocolate,31A,Food & Beverage Manufacture
3114,Fruit and Vegetable Preserving and Specialty Food Manufacturing,31A,Food & Beverage Manufacture
31141,Frozen Food Manufacturing,31A,Food & Beverage Manufacture
31142,"Fruit and Vegetable Canning, Pickling, and Drying",31A,Food & Beverage Manufacture
311411,"Frozen Fruit, Juice, and Vegetable Manufacturing",31A,Food & Beverage Manufacture
311412,Frozen Specialty Food Manufacturing,31A,Food & Beverage Manufacture
311421,Fruit and Vegetable Canning,31A,Food & Beverage Manufacture
311422,Specialty Canning,31A,Food & Beverage Manufacture
311423,Dried and Dehydrated Food Manufacturing,31A,Food & Beverage Manufacture
3115,Dairy Product Manufacturing,31A,Food & Beverage Manufacture
31151,Dairy Product (except Frozen) Manufacturing,31A,Food & Beverage Manufacture
31152,Ice Cream and Frozen Dessert Manufacturing,31A,Food & Beverage Manufacture
311511,Fluid Milk Manufacturing,31A,Food & Beverage Manufacture
311512,Creamery Butter Manufacturing,31A,Food & Beverage Manufacture
311513,Cheese Manufacturing,31A,Food & Beverage Manufacture
311514,"Dry, Condensed, and Evaporated Dairy Product Manufacturing",31A,Food & Beverage Manufacture
311520,Ice Cream and Frozen Dessert Manufacturing,31A,Food & Beverage Manufacture
3116,Animal Slaughtering and Processing,31A,Food & Beverage Manufacture
31161,Animal Slaughtering and Processing,31A,Food & Beverage Manufacture
311611,Animal (except Poultry) Slaughtering,31A,Food & Beverage Manufacture
311612,Meat Processed from Carcasses,31A,Food & Beverage Manufacture
311613,Rendering and Meat Byproduct Processing,31A,Food & Beverage Manufacture
311615,Poultry Processing,31A,Food & Beverage Manufacture
3117,Seafood Product Preparation and Packaging,31A,Food & Beverage Manufacture
31171,Seafood Product Preparation and Packaging,31A,Food & Beverage Manufacture
311710,Seafood Product Preparation and Packaging,31A,Food & Beverage Manufacture
311711,Seafood Canning,31A,Food & Beverage Manufacture
311712,Fresh and Frozen Seafood Processing,31A,Food & Beverage Manufacture
3118,Bakeries and Tortilla Manufacturing,31A,Food & Beverage Manufacture
31181,Bread and Bakery Product Manufacturing,31A,Food & Beverage Manufacture
31182,"Cookie, Cracker, and Pasta Manufacturing",31A,Food & Beverage Manufacture
31183,Tortilla Manufacturing,31A,Food & Beverage Manufacture
311811,Retail Bakeries,31A,Food & Beverage Manufacture
311812,Commercial Bakeries,31A,Food & Beverage Manufacture
311813,"Frozen Cakes, Pies, and Other Pastries Manufacturing",31A,Food & Beverage Manufacture
311821,Cookie and Cracker Manufacturing,31A,Food & Beverage Manufacture
311822,Flour Mixes and Dough Manufacturing from Purchased Flour,31A,Food & Beverage Manufacture
311823,Dry Pasta Manufacturing,31A,Food & Beverage Manufacture
311824,"Dry Pasta, Dough, and Flour Mixes Manufacturing from Purchased Flour",31A,Food & Beverage Manufacture
311830,Tortilla Manufacturing,31A,Food & Beverage Manufacture
3119,Other Food Manufacturing,31A,Food & Beverage Manufacture
31191,Snack Food Manufacturing,31A,Food & Beverage Manufacture
31192,Coffee and Tea Manufacturing,31A,Food & Beverage Manufacture
31193,Flavoring Syrup and Concentrate Manufacturing,31A,Food & Beverage Manufacture
31194,Seasoning and Dressing Manufacturing,31A,Food & Beverage Manufacture
31199,All Other Food Manufacturing,31A,Food & Beverage Manufacture
311911,Roasted Nuts and Peanut Butter Manufacturing,31A,Food & Beverage Manufacture
311919,Other Snack Food Manufacturing,31A,Food & Beverage Manufacture
311920,Coffee and Tea Manufacturing,31A,Food & Beverage Manufacture
311930,Flavoring Syrup and Concentrate Manufacturing,31A,Food & Beverage Manufacture
311941,"Mayonnaise, Dressing, and Other Prepared Sauce Manufacturing",31A,Food & Beverage Manufacture
311942,Spice and Extract Manufacturing,31A,Food & Beverage Manufacture
311991,Perishable Prepared Food Manufacturing,31A,Food & Beverage Manufacture
311999,All Other Miscellaneous Food Manufacturing,31A,Food & Beverage Manufacture
312,Beverage and Tobacco Product Manufacturing,31A,Food & Beverage Manufacture
3121,Beverage Manufacturing,31A,Food & Beverage Manufacture
31211,Soft Drink and Ice Manufacturing,31A,Food & Beverage Manufacture
31212,Breweries,31A,Food & Beverage Manufacture
31213,Wineries,31A,Food & Beverage Manufacture
31214,Distilleries,31A,Food & Beverage Manufacture
312111,Soft Drink Manufacturing,31A,Food & Beverage Manufacture
312112,Bottled Water Manufacturing,31A,Food & Beverage Manufacture
